### ISSUE TITLE
How do I configure external routing

### ISSUE THREAD

**Issue by makuk66** [projectcalico/libnetwork-plugin#21]
How do I configure external routing in the new Docker 1.9 libnetwork with calico?

The particular problem I run into is that I can get packets into the container, but not out again.

I'll demonstrate.

I create a network called 'netalphabeta', and add a calico rule for inbound ICMP:

```
[trinity10] Executing task 'create_networks'
[trinity10] run: docker network create --driver=calico --subnet 192.168.91.0/24 netalphabeta
[trinity10] out: d40eea57e99baac50e57c2dc7159eac0378f13d849de8e31c98db1cc12cdc1f1
[trinity10] out: 

[trinity10] run: docker network ls
[trinity10] out: NETWORK ID          NAME                DRIVER
[trinity10] out: 6a080db420ef        netsolr             calico              
[trinity10] out: d40eea57e99b        netalphabeta        calico              
[trinity10] out: 13fd5c86b05f        none                null                
[trinity10] out: 87b139f81899        host                host                
[trinity10] out: bfcd754ecf23        bridge              bridge              
[trinity10] out: 

[trinity10] Executing task 'configure_network_profiles'
[trinity10] run: docker network ls
[trinity10] out: NETWORK ID          NAME                DRIVER
[trinity10] out: 6a080db420ef        netsolr             calico              
[trinity10] out: d40eea57e99b        netalphabeta        calico              
[trinity10] out: 13fd5c86b05f        none                null                
[trinity10] out: 87b139f81899        host                host                
[trinity10] out: bfcd754ecf23        bridge              bridge              
[trinity10] out: 

[trinity10] run: ./calicoctl profile show
[trinity10] out: +------------------------------------------------------------------+
[trinity10] out: |                               Name                               |
[trinity10] out: +------------------------------------------------------------------+
[trinity10] out: | 6a080db420efe11b19c3812f394236549ac7eab1b8c62b42fdc4959c03ec6ba5 |
[trinity10] out: | d40eea57e99baac50e57c2dc7159eac0378f13d849de8e31c98db1cc12cdc1f1 |
[trinity10] out: +------------------------------------------------------------------+
[trinity10] out: 

[trinity10] run: ./calicoctl profile d40eea57e99baac50e57c2dc7159eac0378f13d849de8e31c98db1cc12cdc1f1 rule add inbound allow icmp
[trinity10] run: docker network ls
[trinity10] out: NETWORK ID          NAME                DRIVER
[trinity10] out: 6a080db420ef        netsolr             calico              
[trinity10] out: d40eea57e99b        netalphabeta        calico              
[trinity10] out: bfcd754ecf23        bridge              bridge              
[trinity10] out: 13fd5c86b05f        none                null                
[trinity10] out: 87b139f81899        host                host                
[trinity10] out: 
```

My physical LAN network layout is:

```
[macbook 192.168.88.9] -- [router1 192.168.88.1,192.168.0.1] -- [router2 192.168.0.2,192.168.77.1] -- [docker host trinity10 192.168.77.10].
```
My router1 has a static route for 192.168.91.0/24 to 192.168.0.2.
My router2 receives routes from Calico, so it has a dynamic route for my containers on trinity10.

Next I run a container on that network, with tcpdump listening for pings on cali0, and try to ping to it from my macbook.

```
mak@trinity10:~/tcpdump$ docker run --privileged --net netalphabeta -it makuk66/docker-tcpdump /bin/bash -c 'ip addr list; ip route list; sudo tcpdump -i cali0 -n icmp'
1: lo: <LOOPBACK,UP,LOWER_UP> mtu 65536 qdisc noqueue state UNKNOWN group default 
    link/loopback 00:00:00:00:00:00 brd 00:00:00:00:00:00
    inet 127.0.0.1/8 scope host lo
       valid_lft forever preferred_lft forever
    inet6 ::1/128 scope host 
       valid_lft forever preferred_lft forever
278: cali0: <NO-CARRIER,BROADCAST,MULTICAST,UP,LOWER_UP> mtu 1500 qdisc pfifo_fast state DOWN group default qlen 1000
    link/ether ee:ee:ee:ee:ee:ee brd ff:ff:ff:ff:ff:ff
    inet 192.168.91.4/24 scope global cali0
       valid_lft forever preferred_lft forever
    inet6 fe80::ecee:eeff:feee:eeee/64 scope link tentative 
       valid_lft forever preferred_lft forever
280: eth1: <BROADCAST,MULTICAST,UP,LOWER_UP> mtu 1500 qdisc noqueue state UNKNOWN group default 
    link/ether 02:42:ac:12:00:05 brd ff:ff:ff:ff:ff:ff
    inet 172.18.0.5/16 scope global eth1
       valid_lft forever preferred_lft forever
    inet6 fe80::42:acff:fe12:5/64 scope link tentative 
       valid_lft forever preferred_lft forever
default via 172.18.0.1 dev eth1 
172.18.0.0/16 dev eth1  proto kernel  scope link  src 172.18.0.5 
192.168.91.0/24 dev cali0  proto kernel  scope link  src 192.168.91.4 
tcpdump: verbose output suppressed, use -v or -vv for full protocol decode
listening on cali0, link-type EN10MB (Ethernet), capture size 65535 bytes
11:54:40.758298 IP 192.168.88.9 > 192.168.91.4: ICMP echo request, id 46974, seq 0, length 64
11:54:41.762171 IP 192.168.88.9 > 192.168.91.4: ICMP echo request, id 46974, seq 1, length 64
11:54:42.766340 IP 192.168.88.9 > 192.168.91.4: ICMP echo request, id 46974, seq 2, length 64
^C
```

```
mak@crab 513 ~ $ ping 192.168.91.4
PING 192.168.91.4 (192.168.91.4): 56 data bytes
Request timeout for icmp_seq 0
Request timeout for icmp_seq 1
^C
```

So the echo requests go into the container, but there are no replies.

Looking at the links and routes, we see a cali0 and eth1, with the default route going to eth1.
If I tcpdump eth1, I don't see any ICMP either.

If I add a specific route, I can make this work:

```
mak@trinity10:~/tcpdump$ docker run --privileged --net netalphabeta -it makuk66/docker-tcpdump /bin/bash -c 'sudo ip route add 192.168.88.0/24 dev cali0; ip addr list; ip route list; tcpdump -i cali0 -n icmp'
1: lo: <LOOPBACK,UP,LOWER_UP> mtu 65536 qdisc noqueue state UNKNOWN group default 
    link/loopback 00:00:00:00:00:00 brd 00:00:00:00:00:00
    inet 127.0.0.1/8 scope host lo
       valid_lft forever preferred_lft forever
    inet6 ::1/128 scope host 
       valid_lft forever preferred_lft forever
282: cali0: <NO-CARRIER,BROADCAST,MULTICAST,UP,LOWER_UP> mtu 1500 qdisc pfifo_fast state DOWN group default qlen 1000
    link/ether ee:ee:ee:ee:ee:ee brd ff:ff:ff:ff:ff:ff
    inet 192.168.91.4/24 scope global cali0
       valid_lft forever preferred_lft forever
    inet6 fe80::ecee:eeff:feee:eeee/64 scope link tentative 
       valid_lft forever preferred_lft forever
284: eth1: <BROADCAST,MULTICAST,UP,LOWER_UP> mtu 1500 qdisc noqueue state UNKNOWN group default 
    link/ether 02:42:ac:12:00:05 brd ff:ff:ff:ff:ff:ff
    inet 172.18.0.5/16 scope global eth1
       valid_lft forever preferred_lft forever
    inet6 fe80::42:acff:fe12:5/64 scope link tentative 
       valid_lft forever preferred_lft forever
default via 172.18.0.1 dev eth1 
172.18.0.0/16 dev eth1  proto kernel  scope link  src 172.18.0.5 
192.168.88.0/24 dev cali0  scope link 
192.168.91.0/24 dev cali0  proto kernel  scope link  src 192.168.91.4 
tcpdump: verbose output suppressed, use -v or -vv for full protocol decode
listening on cali0, link-type EN10MB (Ethernet), capture size 65535 bytes
11:56:08.632703 IP 192.168.88.9 > 192.168.91.4: ICMP echo request, id 60798, seq 0, length 64
11:56:08.632768 IP 192.168.91.4 > 192.168.88.9: ICMP echo reply, id 60798, seq 0, length 64
11:56:09.636184 IP 192.168.88.9 > 192.168.91.4: ICMP echo request, id 60798, seq 1, length 64
11:56:09.636218 IP 192.168.91.4 > 192.168.88.9: ICMP echo reply, id 60798, seq 1, length 64
^C
```

```
PING 192.168.91.4 (192.168.91.4): 56 data bytes
64 bytes from 192.168.91.4: icmp_seq=0 ttl=61 time=0.794 ms
64 bytes from 192.168.91.4: icmp_seq=1 ttl=61 time=0.740 ms
^C
```

When I tried this back in July, the container would get a single `calic0` device, with a default route to that, and it just worked. See for example the second output in calico-docker issue 341.

How can I make make this work with the latest?

Further version details:
```
[trinity10] Executing task 'info'
[trinity10] run: cat /etc/lsb-release
[trinity10] out: DISTRIB_ID=Ubuntu
[trinity10] out: DISTRIB_RELEASE=14.04
[trinity10] out: DISTRIB_CODENAME=trusty
[trinity10] out: DISTRIB_DESCRIPTION="Ubuntu 14.04.3 LTS"
[trinity10] out: 

[trinity10] Executing task 'docker_version'
[trinity10] run: docker version
[trinity10] out: Client:
[trinity10] out:  Version:      1.9.0
[trinity10] out:  API version:  1.21
[trinity10] out:  Go version:   go1.4.2
[trinity10] out:  Git commit:   76d6bc9
[trinity10] out:  Built:        Tue Nov  3 17:43:42 UTC 2015
[trinity10] out:  OS/Arch:      linux/amd64
[trinity10] out: 
[trinity10] out: Server:
[trinity10] out:  Version:      1.9.0
[trinity10] out:  API version:  1.21
[trinity10] out:  Go version:   go1.4.2
[trinity10] out:  Git commit:   76d6bc9
[trinity10] out:  Built:        Tue Nov  3 17:43:42 UTC 2015
[trinity10] out:  OS/Arch:      linux/amd64
[trinity10] out: 
```

**Comment by tomdee** [comment]
Back in June we were taking a slightly different approach to networking with libentwork. back then we assigned a /32 address to the cali0 interface in the container and didn't have an extra interface for the docker bridge. We had a default route to the the calico vrouter (as the default gateway). This approach works well with Calico but relies on using a BGP router for getting traffic to/from the calico network.

With the changes that docker introduced when they added their IPAM driver we could no longer take this approach. Their IPAM provides an IP on a subnet so it was much easier to just accept the libnetwork model of networking. This means Calico works in a similar way to their overlay driver. The "network" created with libnetwork has a subnet and an IP from that subnet is assigned to the container. A route is added only for that subnet to the Calico vrouter. They also added the feature to add a second interface which provides traffic in/out of the Calico network. This is convenient for people who don't have a BGP router but breaks things for people like you that do.


Going forward, I think there's two obvious options here
1) Move to using "calicoctl container add/remove" rather than libnetwork. Not great since it's not easy to ensure that networking is in place before the container starts. But this sticks with the /32 address and the default route.
2) Wait until we've written a Calico IPAM plugin for libnetwork. We're working on this now, but it's going to be a week or two before we have this ready.

There could be a 3rd option - using the existing Calico network driver and libnetwork IPAM driver, but programming different routes into the container. I can't imediately see how to do this, but I think something might be possible so I'll give it some more thought. Suggestions are of course welcome!

**Comment by allanhung** [comment]
The docker libnetwork will create a bridge network "docker_gwbridge" for provding  default gateway for the containers if none of the container's endpoints  have GW set by the driver.
Atfer trace, I think calico driver provide the gw in function CreateEndpoint, but libnetwork driver api only set mac address  and ip. https://github.com/docker/libnetwork/blob/master/driverapi/driverapi.go
I try to provide the gw in function Join, and it works.
And I made a pull request for this change.  https://github.com/projectcalico/libnetwork-plugin/pull/22
Hope this is a correct way.

**Comment by robbrockbank** [comment]
In v0.12.0 of calicoctl, we now use the latest blibnetwork-plugin which contains a Calico IPAM driver.

@maku66, If you use Calico IPAM, we revert to the old behavior of routing everything through the Calico vRouter.  Let me know if this resolves things for you.

**Comment by makuk66** [comment]
I tested 0.12.0; seems to work: I can ping my containers from outside, and the containers have a `cali0` interface only. Thanks!

**Comment by makuk66** [comment]
And thanks for the helpful docs on https://github.com/projectcalico/calico-docker/blob/master/docs/getting-started/libnetwork/Demonstration.md
